{
  "schema_version": "1.0.0",
  "registry_id": "assumption-registry.round-03",
  "registry_version": "1.0.0",
  "as_of": "2026-09-08",
  "truth_assessment": "not_performed_by_contract_validation",
  "assumptions": [
    {
      "assumption_id": "assumption.source-bound-evidence-integrity",
      "version": "1.0.0",
      "exact_statement": "A separately governed source, classification and derivation manifest can detect material mutation, substitution or unsupported provenance before public release.",
      "class": "bounded_hypothesis",
      "scope": {
        "jurisdictions": ["global"],
        "populations": ["public evidence users"],
        "systems": ["snapshot capture, classification, derivation and record indexing"],
        "valid_from": "2026-09-08",
        "valid_until": "2027-03-08",
        "exclusions": ["Upstream facts whose original response bytes were not retained"]
      },
      "stewardship": {
        "owner_ref": "role.evidence-steward",
        "owner_type": "role",
        "status": "under_review",
        "accountability": "Freeze the manifest, retain hostile fixtures and seek independent reproduction."
      },
      "parties": {
        "affected": [
          { "party_id": "public.evidence-users", "description": "People relying on public evidence claims", "representation_state": "not_consulted" },
          { "party_id": "maintainers.evidence", "description": "People maintaining evidence controls", "representation_state": "directly_consulted" }
        ],
        "benefited": [
          { "party_id": "public.evidence-users", "description": "People relying on public evidence claims", "representation_state": "not_consulted" }
        ],
        "burdened": [
          { "party_id": "maintainers.evidence", "description": "People maintaining evidence controls", "representation_state": "directly_consulted" }
        ]
      },
      "evidence_refs": [
        { "ref_id": "review.round-03.containments", "kind": "internal_review", "locator": "reviews/round-03-internal-adversarial-register.md", "verification_state": "repository_local", "relevance": "Records current internal containments and their required falsification tests." }
      ],
      "counterevidence_refs": [
        { "ref_id": "review.round-03.evidence-attacks", "kind": "internal_review", "locator": "reviews/round-03-internal-adversarial-register.md#evidence-kernel-attacks", "verification_state": "repository_local", "relevance": "Five malicious snapshots passed the earlier global build." }
      ],
      "challenge": {
        "kind": "falsifier",
        "testable_prediction": "Every manifest mutation, source substitution and unrecomputed derived value is rejected with a specific error.",
        "observation_that_would_falsify": "Any declared neighbouring mutation passes a clean-checkout build against the frozen release.",
        "test_method": "Run the frozen malicious snapshots plus generated neighbouring attacks under independent review."
      },
      "decision_dependencies": [
        { "decision_id": "decision.publish-evidence-snapshot", "relationship": "blocks_until_resolved", "consequence_if_wrong": "Mutated or unsupported claims may be presented as decision-grade evidence.", "handling": "fail_closed" }
      ],
      "timebox": { "expires_on": "2027-03-08", "next_review_on": "2026-10-08" },
      "replacements": { "replaces": [], "replaced_by": [] },
      "public_disposition": {
        "state": "publish_as_hypothesis",
        "plain_language": "Hypothesis: the new evidence controls are intended to reject source, classification and derivation corruption, but independent reproduction is still outstanding.",
        "rationale": "The design claim is useful only when paired with its failure history and open test."
      },
      "source_findings": ["I03-EV-01", "I03-EV-02", "I03-EV-03", "I03-EV-04", "I03-EV-06", "I03-TM-02", "I03-TM-07", "I03-TM-10", "I03-TM-12", "I03-TM-15"]
    },
    {
      "assumption_id": "assumption.epistemic-class-stays-adjacent",
      "version": "1.0.0",
      "exact_statement": "Every public rendering of a claim must keep its evidence class, timing basis and publication eligibility adjacent enough to survive crop, reflow, print, copy and export.",
      "class": "hard_safeguard",
      "scope": {
        "jurisdictions": ["global"],
        "populations": ["public dashboard readers"],
        "systems": ["cards, charts, comparison views, print, copy and machine exports"],
        "valid_from": "2026-09-08",
        "valid_until": null,
        "exclusions": []
      },
      "stewardship": {
        "owner_ref": "role.public-meaning-steward",
        "owner_type": "role",
        "status": "active",
        "accountability": "Block public release when context can be separated from a claim."
      },
      "parties": {
        "affected": [
          { "party_id": "public.dashboard-readers", "description": "People interpreting public claims", "representation_state": "not_consulted" },
          { "party_id": "maintainers.interface", "description": "People maintaining every rendering surface", "representation_state": "directly_consulted" }
        ],
        "benefited": [
          { "party_id": "public.dashboard-readers", "description": "People interpreting public claims", "representation_state": "not_consulted" }
        ],
        "burdened": [
          { "party_id": "maintainers.interface", "description": "People maintaining every rendering surface", "representation_state": "directly_consulted" }
        ]
      },
      "evidence_refs": [
        { "ref_id": "review.round-03.adjacency-attacks", "kind": "internal_review", "locator": "reviews/round-03-internal-adversarial-register.md", "verification_state": "repository_local", "relevance": "Records class borrowing, hidden clocks and cropped action-boundary attacks." }
      ],
      "counterevidence_refs": [],
      "challenge": {
        "kind": "review_mechanism",
        "review_question": "Can any supported viewport or export preserve the claim while losing its epistemic or authority qualifier?",
        "process": "Review cards, SVG endpoints, compare, mobile, 400 percent zoom, print, copy and machine exports.",
        "decision_rule": "Block the affected surface if the qualifier is missing, borrowed or separable from the claim."
      },
      "decision_dependencies": [
        { "decision_id": "decision.release-public-interface", "relationship": "constrains", "consequence_if_wrong": "A bounded claim may be consumed as observed fact or authorised instruction.", "handling": "fail_closed" }
      ],
      "timebox": { "expires_on": null, "next_review_on": "2026-10-08" },
      "replacements": { "replaces": [], "replaced_by": [] },
      "public_disposition": {
        "state": "publish_as_safeguard",
        "plain_language": "Safeguard: a number or action label must travel with the context needed to interpret it correctly.",
        "rationale": "Correct source data cannot protect a reader after the interface strips away its meaning."
      },
      "source_findings": ["I03-EV-05", "I03-TM-14", "I03-TM-17"]
    },
    {
      "assumption_id": "assumption.point-level-timing-is-decision-adequate",
      "version": "1.0.0",
      "exact_statement": "Point-level source binding, role-aware timing and retained execution evidence can make the timing assessment adequate for bounded publication decisions.",
      "class": "bounded_hypothesis",
      "scope": {
        "jurisdictions": ["global"],
        "populations": ["people relying on time-sensitive signals"],
        "systems": ["external observations, derivations, assessments and scoped exports"],
        "valid_from": "2026-09-08",
        "valid_until": "2027-03-08",
        "exclusions": ["Sources with unresolved acquisition or release intervals"]
      },
      "stewardship": {
        "owner_ref": "role.timing-steward",
        "owner_type": "role",
        "status": "under_review",
        "accountability": "Attack point joins, clocks, role assignments, operands and export boundaries."
      },
      "parties": {
        "affected": [
          { "party_id": "public.signal-users", "description": "People interpreting time-sensitive signals", "representation_state": "not_consulted" },
          { "party_id": "maintainers.timing", "description": "People maintaining timing contracts", "representation_state": "directly_consulted" }
        ],
        "benefited": [
          { "party_id": "public.signal-users", "description": "People interpreting time-sensitive signals", "representation_state": "not_consulted" }
        ],
        "burdened": [
          { "party_id": "maintainers.timing", "description": "People maintaining timing contracts", "representation_state": "directly_consulted" }
        ]
      },
      "evidence_refs": [
        { "ref_id": "review.round-03.timing-containments", "kind": "internal_review", "locator": "reviews/round-03-internal-adversarial-register.md#timing-and-record-attacks", "verification_state": "repository_local", "relevance": "Documents internally contained timing attacks and the remaining independent-review requirement." }
      ],
      "counterevidence_refs": [
        { "ref_id": "review.round-03.timing-failures", "kind": "internal_review", "locator": "reviews/round-03-internal-adversarial-register.md#timing-and-record-attacks", "verification_state": "repository_local", "relevance": "A green first implementation hid multiple timing and record failures." }
      ],
      "challenge": {
        "kind": "falsifier",
        "testable_prediction": "Every governed point reports its own source binding, role, interval, lineage and publication eligibility without borrowing another point's state.",
        "observation_that_would_falsify": "A role swap, omitted operand, invented clock, point substitution or dangling export passes the frozen challenge pack.",